{
  "schema_version": "1.0.0",
  "event_id": "evt_research_wp0_artifact_register_0001",
  "stream_id": "research",
  "sequence": 1,
  "event_type": "research.artifact_search_recorded",
  "occurred_at": "2026-08-11T16:51:15Z",
  "recorded_at": "2026-08-11T16:51:15Z",
  "actor": {
    "id": "adapter:codex",
    "role": "agent_observer",
    "auth_basis": "Repository owner directed the bounded Work Packet 0 audit and recording pass."
  },
  "classification": "PUBLIC",
  "consequence_class": "C1",
  "parents": [
    "evt_governance_wp0_authority_freeze_0001"
  ],
  "prev_event_hash": "",
  "payload_hash": "3c6584fa71e3abdb8ba8bf33eb3b3d6a905e9fa44b43de0d5ba35917eaf151d1",
  "event_hash": "b8661fda03f6da05e89507eb632c81a42bbdbe287c507ef66b9b8cb4074d105a",
  "read_set": [
    "owner-supplied public research artifacts",
    "bounded local search scope"
  ],
  "write_set": [
    "governance/artifact-register.json"
  ],
  "precondition_refs": [
    "governance-authority-freeze"
  ],
  "evidence_refs": [
    {
      "ref_id": "artifact-register-pre-ledger-snapshot",
      "kind": "pre_ledger_snapshot",
      "classification": "PUBLIC",
      "sha256": "a199024060b71dcf9e41757542687bd79bb02ff9c873f398d228326c15d3a0c0",
      "source_locator": "governance/artifact-register.json"
    }
  ],
  "authority_ref": "evt_governance_wp0_authority_freeze_0001",
  "idempotency_key": "wp0.5:research:genesis:artifact-search",
  "decision": "DEFER",
  "status_axes": {
    "evidence": "VERIFIED",
    "authority": "UNVERIFIED",
    "preparation": "PASS",
    "execution": "PASS",
    "observation": "OBSERVED",
    "acceptance": "DEFER",
    "outcome": "UNKNOWN"
  },
  "effect": {
    "kind": "NONE",
    "target": null,
    "reversible": true,
    "recovery_ref": null
  },
  "supersedes": [],
  "correction_of": [],
  "payload": {
    "projection": {
      "path": "governance/artifact-register.json",
      "record": {
        "schema_version": "0.1.0",
        "register_id": "delta-atlas-research-artifacts-2026-08-11",
        "recorded_at": "2026-08-11T16:51:15Z",
        "hash_algorithm": "SHA-256",
        "artifacts": [
          {
            "artifact_id": "state-transition-protocol-v1.1-pdf",
            "display_name": "State Transition Protocol v1.1.pdf",
            "media_type": "application/pdf",
            "byte_length": 889709,
            "sha256": "48aad2ce2f660f32c4af54547c189168bec722053a8e06b25946624ad2f30bf2",
            "classification": "PUBLIC",
            "classification_basis": "The artifact publication record states open source independent research under CC BY 4.0.",
            "source": "owner_supplied_attachment",
            "repository_state": "not_committed",
            "acceptance_status": "ACCEPT_WITH_LIMITS",
            "limits": [
              "The release-provenance ledger pin does not resolve to an artifact found in the bounded local search."
            ]
          },
          {
            "artifact_id": "calibration-ledger-v8-attached-docx",
            "display_name": "Calibration Ledger v8 -.docx",
            "media_type": "application/vnd.openxmlformats-officedocument.wordprocessingml.document",
            "byte_length": 48858,
            "sha256": "17916bcf43158c6c875cd08352bc2d3c72c84844ff43dc8e86ee9621f4866927",
            "classification": "PUBLIC",
            "classification_basis": "The artifact front matter states OPEN SOURCE WORKING SPECIFICATION under CC BY 4.0.",
            "source": "owner_supplied_attachment",
            "repository_state": "not_committed",
            "acceptance_status": "CANDIDATE",
            "limits": [
              "Its byte hash does not match the protocol's asserted Calibration Ledger v8 hash.",
              "It is not accepted as the pinned ledger release."
            ]
          }
        ],
        "claims": [
          {
            "claim_id": "stp-v1.1-calibration-ledger-v8-pin",
            "source_artifact_id": "state-transition-protocol-v1.1-pdf",
            "target_label": "Calibration Ledger v8",
            "asserted_sha256": "32f0159d34ee012c3fc009f905b9f557cf4767f7eaf1e1de05404ae5792a19da",
            "relation_status": "UNVERIFIED",
            "decision": "DEFER",
            "reason": "The asserted hash differs from the attached DOCX and no exact match was found in the bounded local search."
          }
        ],
        "bounded_search_evidence": {
          "searched_at": "2026-08-11T16:51:15Z",
          "scope_labels": [
            "owner Downloads tree",
            "2026-08-09 research workspace"
          ],
          "files_hashed": 452,
          "read_errors": 0,
          "exact_matches_for_asserted_hash": 0,
          "decision": "DEFER",
          "next_evidence": "Provide the exact artifact whose bytes hash to the asserted value, or publish a typed amendment that supersedes the pin."
        }
      }
    },
    "negative_space": {
      "inspected": [
        "owner Downloads tree",
        "2026-08-09 research workspace"
      ],
      "files_hashed": 452,
      "read_errors": 0,
      "not_inspected": [
        "unavailable devices",
        "unconnected accounts",
        "unprovided remote storage"
      ],
      "claim_ceiling": "No exact match was found inside the bounded inspected scope; global absence is not claimed."
    }
  }
}
